{
  "capability_tags": [
    "2d",
    "parallel",
    "analytic",
    "clean",
    "ground_truth"
  ],
  "case_id": "parallel_2d/disk_analytic_32",
  "dimension": 2,
  "geometry": {
    "angles_rad": [
      0.0,
      0.09817477315664291,
      0.19634954631328583,
      0.29452431201934814,
      0.39269909262657166,
      0.49087387323379517,
      0.5890486240386963,
      0.6872234344482422,
      0.7853981852531433,
      0.8835729360580444,
      0.9817477464675903,
      1.0799225568771362,
      1.1780972480773926,
      1.2762720584869385,
      1.3744468688964844,
      1.4726215600967407,
      1.5707963705062866,
      1.6689711809158325,
      1.7671458721160889,
      1.8653206825256348,
      1.9634954929351807,
      2.0616703033447266,
      2.1598451137542725,
      2.2580196857452393,
      2.356194496154785,
      2.454369306564331,
      2.552544116973877,
      2.650718927383423,
      2.7488937377929688,
      2.8470683097839355,
      2.9452431201934814,
      3.0434179306030273
    ],
    "detector_count": 32,
    "detector_spacing": 0.0625,
    "domain_shape": [
      1,
      32,
      32
    ],
    "image_layout": [
      "channel",
      "y",
      "x"
    ],
    "length_unit": "normalized_image_coordinate",
    "measurement_layout": [
      "channel",
      "angle",
      "detector"
    ],
    "range_shape": [
      1,
      32,
      32
    ],
    "type": "parallel_2d"
  },
  "ground_truth": {
    "data_range": 0.02,
    "quantity": "linear_attenuation",
    "unit": "normalized_inverse_length"
  },
  "measurement": {
    "kind": "line_integral",
    "noise_model": "none",
    "parameters": {},
    "seed": null
  },
  "modality": "xray_ct",
  "provenance": {
    "generator": "closed_form_parallel_beam_disk_chord_length",
    "license": "project-generated",
    "reference_kind": "analytic_independent"
  },
  "schema_version": "1.0",
  "sha256": {
    "arrays.h5": "19cd8a8bbca958ebe2096c835479794bf644bff8aaebf8e7666c9cd4dc11743e"
  }
}
