{
  "capability_tags": [
    "2d",
    "parallel",
    "quality",
    "synthetic_tissue",
    "backend_reference",
    "ground_truth",
    "clean",
    "limited_angle"
  ],
  "case_id": "parallel_2d/tissue_breast_limited_angle_128",
  "dimension": 2,
  "geometry": {
    "angles_rad": [
      0.0,
      0.01745329238474369,
      0.03490658476948738,
      0.05235987901687622,
      0.06981316953897476,
      0.0872664600610733,
      0.10471975803375244,
      0.12217305600643158,
      0.13962633907794952,
      0.15707963705062866,
      0.1745329201221466,
      0.19198623299598694,
      0.20943951606750488,
      0.22689279913902283,
      0.24434611201286316,
      0.2617993950843811,
      0.27925267815589905,
      0.2967059910297394,
      0.3141592741012573,
      0.33161255717277527,
      0.3490658402442932,
      0.36651915311813354,
      0.3839724659919739,
      0.4014257490634918,
      0.41887903213500977,
      0.4363323152065277,
      0.45378559827804565,
      0.471238911151886,
      0.4886922240257263,
      0.5061455368995667,
      0.5235987901687622,
      0.5410520434379578,
      0.5585053563117981,
      0.5759586691856384,
      0.5934119820594788,
      0.6108652949333191,
      0.6283185482025146,
      0.645771861076355,
      0.6632251143455505,
      0.6806784272193909,
      0.6981316804885864,
      0.7155849933624268,
      0.7330383062362671,
      0.7504915595054626,
      0.7679449319839478,
      0.7853981852531433,
      0.8028514981269836,
      0.8203047513961792,
      0.8377580642700195,
      0.8552113771438599,
      0.8726646304130554,
      0.8901179432868958,
      0.9075711965560913,
      0.9250245690345764,
      0.942477822303772,
      0.9599311351776123,
      0.9773844480514526,
      0.9948377013206482,
      1.0122910737991333,
      1.029744267463684,
      1.0471975803375244,
      1.0646508932113647,
      1.0821040868759155,
      1.0995575189590454,
      1.1170107126235962,
      1.1344640254974365,
      1.1519173383712769,
      1.1693706512451172,
      1.1868239641189575,
      1.2042771577835083,
      1.2217305898666382,
      1.239183783531189,
      1.2566370964050293,
      1.2740904092788696,
      1.29154372215271,
      1.3089969158172607,
      1.326450228691101,
      1.343903660774231,
      1.3613568544387817,
      1.378810167312622,
      1.3962633609771729,
      1.4137167930603027,
      1.4311699867248535,
      1.4486232995986938,
      1.4660766124725342,
      1.4835299253463745,
      1.5009831190109253,
      1.5184364318847656,
      1.5358898639678955,
      1.5533430576324463,
      1.5707963705062866,
      1.588249683380127,
      1.6057029962539673,
      1.623156189918518,
      1.6406095027923584,
      1.6580628156661987,
      1.675516128540039,
      1.6929694414138794,
      1.7104227542877197,
      1.72787606716156,
      1.7453292608261108,
      1.7627825736999512,
      1.7802358865737915,
      1.7976891994476318,
      1.8151423931121826,
      1.8325958251953125,
      1.8500491380691528,
      1.8675023317337036,
      1.884955644607544,
      1.9024089574813843,
      1.9198622703552246,
      1.9373154640197754,
      1.9547688961029053,
      1.972222089767456,
      1.9896754026412964,
      2.0071287155151367,
      2.0245821475982666,
      2.0420353412628174,
      2.059488534927368,
      2.076941728591919
    ],
    "angular_coverage_deg": 118.99999237060547,
    "detector_count": 128,
    "detector_spacing_pixels": 1.0,
    "domain_shape": [
      1,
      128,
      128
    ],
    "image_layout": [
      "channel",
      "y",
      "x"
    ],
    "length_unit": "pixel",
    "measurement_layout": [
      "channel",
      "angle",
      "detector"
    ],
    "pixel_spacing_cm": 0.1,
    "range_shape": [
      1,
      120,
      128
    ],
    "type": "parallel_2d"
  },
  "ground_truth": {
    "data_range": 0.004,
    "display_scale_to_cm_inverse": 10.0,
    "display_window_cm_inverse": [
      0.0175,
      0.0255
    ],
    "origin": "deterministic synthetic tissue phantom; not patient data",
    "pixel_spacing_cm": 0.1,
    "quantity": "voxel_line_attenuation",
    "unit": "dimensionless_per_pixel"
  },
  "measurement": {
    "kind": "line_integral",
    "noise_model": "none",
    "parameters": {},
    "seed": null
  },
  "modality": "xray_ct",
  "provenance": {
    "generator": "ASTRA 2.4.1 2D line projector",
    "inverse_crime_control": "reference measurements use ASTRA ray-driven line projection; reconstruction uses invframework grid-sample rotation projection",
    "license": "project-generated synthetic arrays; ASTRA GPL-3.0 backend",
    "phantom_generator": "deterministic_multiscale_breast_tissue_v1",
    "reconstruction_operator_under_test": "inv_framework.operators.ct.ParallelBeamRadon2D",
    "reference_kind": "backend_reference"
  },
  "schema_version": "1.0",
  "sha256": {
    "arrays.h5": "e85d0c193a44a6b918921402fa36aad1a5c777fa3a73bc343e514dc1fca10f53"
  }
}
