{
  "capability_tags": [
    "2d",
    "parallel",
    "ground_truth",
    "sparse_view",
    "noisy"
  ],
  "case_id": "parallel_2d/shepp_logan_sparse_gaussian_32",
  "dimension": 2,
  "geometry": {
    "angles_rad": [
      0.0,
      0.19634954631328583,
      0.39269909262657166,
      0.5890486240386963,
      0.7853981852531433,
      0.9817477464675903,
      1.1780972480773926,
      1.3744468688964844,
      1.5707963705062866,
      1.7671458721160889,
      1.9634954929351807,
      2.1598451137542725,
      2.356194496154785,
      2.552544116973877,
      2.7488937377929688,
      2.9452431201934814
    ],
    "detector_count": 32,
    "detector_spacing": 0.0625,
    "domain_shape": [
      1,
      32,
      32
    ],
    "image_layout": [
      "channel",
      "y",
      "x"
    ],
    "length_unit": "normalized_image_coordinate",
    "measurement_layout": [
      "channel",
      "angle",
      "detector"
    ],
    "range_shape": [
      1,
      16,
      32
    ],
    "type": "parallel_2d"
  },
  "ground_truth": {
    "data_range": 0.02,
    "quantity": "linear_attenuation",
    "unit": "normalized_inverse_length"
  },
  "measurement": {
    "kind": "line_integral",
    "noise_model": "gaussian_relative",
    "parameters": {
      "relative_l2_fraction": 0.01
    },
    "seed": 20260731
  },
  "modality": "xray_ct",
  "provenance": {
    "generator": "inv_framework.operators.ct.ParallelBeamRadon2D",
    "license": "project-generated",
    "reference_kind": "model_matched"
  },
  "schema_version": "1.0",
  "sha256": {
    "arrays.h5": "77022a1a307f7a62a2eabd65ab3c4920c7e1f87448f8f51115e9eca6b4ee7556"
  }
}
