{
  "capability_tags": [
    "2d",
    "parallel",
    "ground_truth",
    "clean"
  ],
  "case_id": "parallel_2d/shepp_logan_dense_clean_32",
  "dimension": 2,
  "geometry": {
    "angles_rad": [
      0.0,
      0.05235987901687622,
      0.10471975803375244,
      0.15707963705062866,
      0.20943951606750488,
      0.2617993950843811,
      0.3141592741012573,
      0.36651915311813354,
      0.41887903213500977,
      0.471238911151886,
      0.5235987901687622,
      0.5759586691856384,
      0.6283185482025146,
      0.6806784272193909,
      0.7330383062362671,
      0.7853981852531433,
      0.8377580642700195,
      0.8901179432868958,
      0.942477822303772,
      0.9948377013206482,
      1.0471975803375244,
      1.0995573997497559,
      1.1519173383712769,
      1.2042772769927979,
      1.2566370964050293,
      1.3089969158172607,
      1.3613568544387817,
      1.4137167930603027,
      1.4660766124725342,
      1.5184364318847656,
      1.5707963705062866,
      1.6231563091278076,
      1.675516128540039,
      1.7278759479522705,
      1.7802358865737915,
      1.8325958251953125,
      1.884955644607544,
      1.9373154640197754,
      1.9896754026412964,
      2.0420353412628174,
      2.094395160675049,
      2.1467549800872803,
      2.1991147994995117,
      2.2514748573303223,
      2.3038346767425537,
      2.356194496154785,
      2.4085545539855957,
      2.460914373397827,
      2.5132741928100586,
      2.56563401222229,
      2.6179938316345215,
      2.670353889465332,
      2.7227137088775635,
      2.775073528289795,
      2.8274335861206055,
      2.879793405532837,
      2.9321532249450684,
      2.9845130443573,
      3.0368728637695312,
      3.089232921600342
    ],
    "detector_count": 32,
    "detector_spacing": 0.0625,
    "domain_shape": [
      1,
      32,
      32
    ],
    "image_layout": [
      "channel",
      "y",
      "x"
    ],
    "length_unit": "normalized_image_coordinate",
    "measurement_layout": [
      "channel",
      "angle",
      "detector"
    ],
    "range_shape": [
      1,
      60,
      32
    ],
    "type": "parallel_2d"
  },
  "ground_truth": {
    "data_range": 0.02,
    "quantity": "linear_attenuation",
    "unit": "normalized_inverse_length"
  },
  "measurement": {
    "kind": "line_integral",
    "noise_model": "none",
    "parameters": {},
    "seed": null
  },
  "modality": "xray_ct",
  "provenance": {
    "generator": "inv_framework.operators.ct.ParallelBeamRadon2D",
    "license": "project-generated",
    "reference_kind": "model_matched"
  },
  "schema_version": "1.0",
  "sha256": {
    "arrays.h5": "6e2055340aaa23323c67300c5399ce87a0786269f12858d655a73421c035e622"
  }
}
